{
  "schema_version": 1,
  "command_plane": "DEVICE_MANAGEMENT",
  "request_id": "8f14e45f-ceea-467a-9e3e-8f14e45fceea",
  "device_id": "module-07",
  "system_id": "system-a",
  "provisioning_key_fingerprint": "aaaaaaaaaaaaaaaaaaaaaaaaaaaaaaaaaaaaaaaaaaaaaaaaaaaaaaaaaaaaaaaa",
  "signature_alg": "ECDSA-P256-SHA256-P1363-B64URL",
  "signature": "MEUCIQDexampleexampleexampleexampleexampleexampleexampleexampleAA",
  "issued_at_ms": 1788000000000,
  "action": "PREPARE",
  "mode": "NORMAL",
  "provisioning_sequence": 20,
  "rotation_id": "44444444-4444-4444-8444-444444444444",
  "current_epoch": "22222222-2222-4222-8222-222222222222",
  "next_epoch": "55555555-5555-4555-8555-555555555555"
}
